{"atlasInputs":{"forge-abi.jsonl.gz":"00cf7140e59d45b30dac00035016f1f3c4f7b461b3c82402eee1cad390d35232","neoforge-abi.jsonl.gz":"fd426a4e8d58a60da1e9594c53878fcd94bee50a4ab26581bfa8744e1e9f0989"},"data":{"recommendedUniqueNextObjective":"supplier-boundary","tasks":[{"acceptance":["native Forge baseline first, identical original JAR on NeoForge","independent controlled Item registration C/T, official RegisterEvent and owner Bus/holder identity","supplier code byte-equal except separately approved exact API edges","unknowns fail closed; FnF Tab/global bus remain rejected"],"api":["Item(Properties)","Item.Properties.food/stacksTo","owned Item subclass constructors"],"dependsOn":[],"id":"supplier-boundary","negativeFixtures":["unknown Forge API or bootstrap","captured or foreign/unowned handle","wrong return/stack/field alias","reflection or unknown side effect","partial closure failure leaves all original nodes unchanged","old 4B/007B/Context negative contracts unchanged"],"outOfScope":["enable whole FnF closure","global event APIs","Tab","client behavior"],"phase":"4C-1 recommended sole objective","positiveFixtures":["renamed mod/entry/helper with ordinary Item","native Forge FoodProperties static data + Item supplier","independent custom Item(Properties,int) constructor and native override"],"productionCandidates":["ForgeRegistryTransformationPlan.supplier","RegistryBytecodeVerifier"],"scope":"Independent controlled Item supplier API/type/dataflow boundary validation, preserving supplier instruction bytes; no FnF identity rules"},{"acceptance":["native Forge then NeoForge identical fixture","real Tab registration and registry identity","UI display verification separate client gate"],"api":["DeferredRegister.create(ResourceKey,String)","DeferredHolder<CreativeModeTab,CreativeModeTab>","DisplayItemsGenerator.accept(parameters,output)"],"dependsOn":["supplier-boundary"],"id":"typed-tab-closure","negativeFixtures":["wrong registry generic","early Holder.get","foreign/captured callback","missing consumer","conflicting rewritten descriptors"],"phase":"later independent task","positiveFixtures":["one Tab, one icon and a display callback referencing both Item holder classes"],"scope":"Typed ResourceKey<CreativeModeTab> create/register and full icon/display Holder closure; extend the independently verified internal bridge registry-key contract, currently ITEM-only, rather than reusing it for Tab unchanged"},{"acceptance":["native Forge event oracle and NeoForge same lifecycle comparison","unsupported listener semantics reject before publish","do not equate Registry bridge with general event bus adapter"],"api":["MinecraftForge.EVENT_BUS","IEventBus.register(Object)","NeoForge.EVENT_BUS"],"dependsOn":[],"id":"global-event-semantics","negativeFixtures":["Mod Bus mistaken as global","unverified event class","static/instance and inherited listener mismatch","wrong phase or duplicate registration","unsupported priority/cancellation/post"],"phase":"separate bridge task","positiveFixtures":["handler-free instance registration, verify official target registration path","actual supported annotated instance listener dispatched exactly once on controlled event"],"scope":"Explicit global register(Object) contract, ownership/timing and event type mapping; no no-op registration"},{"acceptance":["actual furnace consumption/ticks and effects, not just method presence","client rendering/UI/eating/persistence separately verified"],"dependsOn":["supplier-boundary","typed-tab-closure","global-event-semantics"],"id":"native-behavior","negativeFixtures":["getBurnTime method present but not dispatched","wrong RecipeType overload or item identity"],"phase":"later gameplay gate","positiveFixtures":["same food component properties","non-fuel vs custom fuel, differing RecipeType and burn ticks"],"scope":"Native-versus-host food components/effects and real furnace FuelItem override dispatch; no generic food shim absent evidence"},{"acceptance":["no diagnostic injection/business properties","input SHA identical","67 real items plus one Tab registration and official bus proofs","separate food/fuel/client/persistence gates"],"dependsOn":["supplier-boundary","typed-tab-closure","global-event-semantics"],"id":"original-fnf-run","phase":"only after complete closure approval","scope":"Original pinned JAR standard two-JAR server run; preserve all calls and record first actual failure"}]},"dataset":"next-task-dependencies","inputSHA256":"bd415b04529c4ffc31e14757488f71dab6917e4560c61e236c3c4d0de6557958","productionRulesEnabled":0,"runtime":"NOT RUN","scanSHA256":"03c3adce84a837a0c3c1aa030ec234a1dd399be4019e5265ab15858d21e1ea6f","schemaVersion":1}
