{"atlasInputs":{"forge-abi.jsonl.gz":"00cf7140e59d45b30dac00035016f1f3c4f7b461b3c82402eee1cad390d35232","neoforge-abi.jsonl.gz":"fd426a4e8d58a60da1e9594c53878fcd94bee50a4ab26581bfa8744e1e9f0989"},"data":{"boundaries":[{"evidence":["dualforge/src/main/java/io/github/gfander/dualforge/ForgeRegistryTransformationPlan.java#isCandidate","class-inventory.json#FoodNFuel.<init>","actual-FML-contract/fnf-admission.stdout.log"],"id":"profile-global-bus","next":"global-event-semantics","reason":"Any MinecraftForge field owner excludes 4B helper candidacy; this is not the forced planning failure","result":"HELPER_NOT_CANDIDATE; original CONTEXT retained","stage":"NORMAL_PROFILE_SELECTION"},{"evidence":["dualforge/src/main/java/io/github/gfander/dualforge/ForgeRegistryTransformationPlan.java#supplier","supplier-classification.json","actual-FML-contract/fnf-admission.stdout.log"],"exactMessage":"Registry helper rejected: SUPPLIER_BUSINESS_UNSUPPORTED","id":"forced-supplier","next":"supplier-boundary","result":"REJECTED","stage":"FORCED_READ_ONLY_PLAN"},{"evidence":["api-usage-matrix.json","reference-closure.json"],"id":"item-closure","next":"supplier-boundary","reason":"4B Item typed create/register/holder/internal owning Bus bridge exist only in validated group; one matching supplier does not admit full group","result":"LOCAL_PRIMITIVES_ONLY; no FnF plan output","stage":"STATIC_DEPENDENCY_CLOSURE"},{"evidence":["supplier-classification.json#TAB_REGISTRATION_SUPPLIER","class-inventory.json#FnFCreativeModeTabs"],"id":"tab-closure","next":"typed-tab-closure","reason":"ResourceKey registry, typed Tab holder, builder callback and icon are outside Item-only helper validator","result":"NEW_ASM_RULE_REQUIRED","stage":"STATIC_DEPENDENCY_CLOSURE"},{"evidence":["api-usage-matrix.json#MinecraftForge.EVENT_BUS","class-inventory.json#FoodNFuel.<init>"],"id":"global-bus","next":"global-event-semantics","reason":"Mod Bus view/Registry attachment is not global register(Object) support; scanned instance has no subscribed handlers, but call cannot be deleted or called generally compatible","result":"RUNTIME_BRIDGE_REQUIRED","stage":"CONSTRUCTOR_AND_EVENT_LIFECYCLE"},{"evidence":["class-inventory.json#FnFFoodProperties","class-inventory.json#FuelItem.getBurnTime"],"id":"food-fuel","next":"native-behavior","reason":"Native ABI resolves; Food effects, item components and furnace dispatch still need native-vs-host behavioral controls","result":"NOT RUN","stage":"GAME_BEHAVIOR"},{"evidence":["api-usage-matrix.json#org/jetbrains/annotations/Nullable"],"id":"nullable","reason":"Compile-only annotation absent from selected server atlas; retain both sites, not proof of runtime failure","result":"UNRESOLVED","stage":"ANNOTATION_STATIC_RESOLUTION","usePoints":2},{"id":"historical-runtime","reason":"ItemRegistries.<clinit> NoClassDefFoundError net/minecraftforge/registries/ForgeRegistries; no claimed progress beyond this actual runtime point","result":"FAIL inherited; NOT RERUN","stage":"INHERITED_C3_RUNTIME"},{"evidence":["dualforge/src/main/java/io/github/gfander/dualforge/ForgeRegistryBridge.java#register"],"id":"registry-bus-key","next":"typed-tab-closure","reason":"Bridge requires receiver.getRegistryKey() == Registries.ITEM; correct owner Bus alone does not authorize Creative Tab registry attachment","result":"ITEM_ONLY; TAB_NOT_SUPPORTED","stage":"OWNED_MOD_BUS_BRIDGE"}],"c4a":"PARTIAL","client":"NOT RUN","fnfRuntime":"NOT RUN","newProductionCapability":false,"status":"STATIC_ANALYSIS_ONLY"},"dataset":"compatibility-frontier","inputSHA256":"bd415b04529c4ffc31e14757488f71dab6917e4560c61e236c3c4d0de6557958","productionRulesEnabled":0,"runtime":"NOT RUN","scanSHA256":"03c3adce84a837a0c3c1aa030ec234a1dd399be4019e5265ab15858d21e1ea6f","schemaVersion":1}
